[
  {
    "id": "vdot-drpt-virginia-department-of-transportation-vdot-department",
    "name": "SOR EXAMPLE_APP DEV_16998_VDOT SOR Smart Portal 2022 FINAL.docx",
    "summary": "Statement of Requirements (SOR) for enhancements and ongoing support of the Virginia Department of Transportation's (VDOT) SMART Portal. The project delivers multi-phase web application improvements for intake, validation, screening, and scoring of transportation grant applications.",
    "sorType": "Application Development",
    "services": [
      "Application Development",
      "Support & Maintenance"
    ],
    "industries": [
      "Transportation",
      "Government"
    ],
    "primaryTechnology": [
      "Web Application",
      "GIS"
    ],
    "techFocus": [
      "Workflow Automation",
      "Data Management"
    ],
    "sector": "Public",
    "jurisdiction": {
      "level": "State",
      "state": "Virginia"
    },
    "agency": "VDOT, DRPT",
    "clientType": "State Agency",
    "client": "Virginia Department of Transportation (VDOT) / Department of Rail and Public Transportation (DRPT)",
    "date": "2021-05-10",
    "pricingModel": "Fixed Price",
    "deliveryModel": "Hybrid",
    "securityCompliance": [],
    "constraints": [
      "Agile",
      "Multi-phase",
      "Remote"
    ],
    "fundingType": "N/A",
    "complexity": "Medium",
    "tags": [],
    "documentPath": "existingSORDocs/SORdocs/SOR EXAMPLE_APP DEV_16998_VDOT SOR Smart Portal 2022 FINAL.docx",
    "version": "1.0",
    "lastReviewed": "2025-08-26"
  },
  {
    "id": "city-of-fredericksburg-information-technology-division-city-of-f",
    "name": "SOR EXAMPLE_SP_17923_Fredericksburg SOR IT Strategic Plan FINAL.docx",
    "summary": "Statement of Requirements for a 5-year IT Strategic Plan for the City of Fredericksburg, including assessment of IT systems, staffing, business processes, and creation of a future-state roadmap covering governance, data, cloud, cybersecurity, and technology prioritization.",
    "sorType": "IT Strategic Planning",
    "services": [
      "Strategic Planning",
      "IT Assessment"
    ],
    "industries": [
      "Local Government",
      "Public Administration"
    ],
    "primaryTechnology": [
      "Microsoft Office",
      "Survey Tools"
    ],
    "techFocus": [
      "Strategic Planning",
      "IT Governance"
    ],
    "sector": "Public",
    "jurisdiction": {
      "level": "Local",
      "state": "Virginia"
    },
    "agency": "City of Fredericksburg, Information Technology Division",
    "clientType": "Local Government",
    "client": "City of Fredericksburg — Information Technology Division",
    "date": "2023-07-10",
    "pricingModel": "Fixed Price",
    "deliveryModel": "Hybrid",
    "securityCompliance": [],
    "constraints": [
      "Survey-Driven",
      "Council Presentation",
      "SWOT Analysis",
      "5-Year Roadmap",
      "Implementation Support Option",
      "Multi-Departmental Scope",
      "Staff/Stakeholder Engagement",
      "Onsite/Remote"
    ],
    "fundingType": "N/A",
    "complexity": "Medium",
    "tags": [],
    "documentPath": "existingSORDocs/SORdocs/SOR EXAMPLE_SP_17923_Fredericksburg SOR IT Strategic Plan FINAL.docx",
    "version": "1.0",
    "lastReviewed": "2025-08-26"
  },
  {
    "id": "vdh-office-of-information-management-virginia-department-of-heal",
    "name": "SOR EXAMPLE_APP DEV_18073_VDH_SOR_Agency Grant Management System MSDY Final.docx",
    "summary": "Statement of Requirements for a new Agency Grant Management System for the Virginia Department of Health (VDH). Project covers lifecycle grants management, workflow automation, reporting, data migration, security, and user training on the Microsoft Dynamics platform.",
    "sorType": "Application Development",
    "services": [
      "Application Development",
      "Systems Integration"
    ],
    "industries": [
      "Health",
      "Government"
    ],
    "primaryTechnology": [
      "Microsoft Dynamics"
    ],
    "techFocus": [
      "Grant Management",
      "Workflow Automation"
    ],
    "sector": "Public",
    "jurisdiction": {
      "level": "State",
      "state": "Virginia"
    },
    "agency": "VDH, Office of Information Management",
    "clientType": "State Agency",
    "client": "Virginia Department of Health (VDH) — Office of Information Management",
    "date": "2023-12-11",
    "pricingModel": "Fixed Price",
    "deliveryModel": "Hybrid",
    "securityCompliance": [],
    "constraints": [
      "No Offshore",
      "Multiple Integrations",
      "Training Required",
      "Remote"
    ],
    "fundingType": "ARPA",
    "complexity": "High",
    "tags": [],
    "documentPath": "existingSORDocs/SORdocs/SOR EXAMPLE_APP DEV_18073_VDH_SOR_Agency Grant Management System MSDY Final.docx",
    "version": "1.0",
    "lastReviewed": "2025-08-26"
  },
  {
    "id": "virginia-it-agency-office-of-regulatory-management-virginia-info",
    "name": "SOR EXAMPLE_SP_17791_VITA SOR ORM State Permit Tracking FINAL.docx",
    "summary": "Statement of Requirements for a strategic assessment and roadmap to improve business process efficiency, transparency, and data reporting for state permit tracking across five Virginia agencies, culminating in an enterprise dashboard plan.",
    "sorType": "Strategic Planning",
    "services": [
      "IT Strategic Planning",
      "Business Process Reengineering"
    ],
    "industries": [
      "Government",
      "Regulatory"
    ],
    "primaryTechnology": [
      "Microsoft .NET",
      "PowerBI",
      "Oracle"
    ],
    "techFocus": [
      "Process Improvement",
      "Data Integration"
    ],
    "sector": "Public",
    "jurisdiction": {
      "level": "State",
      "state": "Virginia"
    },
    "agency": "Virginia IT Agency, Office of Regulatory Management",
    "clientType": "State Agency",
    "client": "Virginia Information Technologies Agency (VITA) — Office of Regulatory Management",
    "date": "2023-03-03",
    "pricingModel": "Fixed Price",
    "deliveryModel": "Hybrid",
    "securityCompliance": [],
    "constraints": [
      "Multi-Agency",
      "Dashboard Roadmap",
      "Phase-Based",
      "Agile",
      "Knowledge Transfer",
      "IV&V Option",
      "Onsite/Remote"
    ],
    "fundingType": "State",
    "complexity": "Medium",
    "tags": [],
    "documentPath": "existingSORDocs/SORdocs/SOR EXAMPLE_SP_17791_VITA SOR ORM State Permit Tracking FINAL.docx",
    "version": "1.0",
    "lastReviewed": "2025-08-26"
  },
  {
    "id": "dcjs-dlrs-virginia-department-of-criminal-justice-services-dcjs",
    "name": "SOR EXAMPLE_BPR_17578_DCJS SOR Credential Mgmt Business Process Analysis FINAL.docx",
    "summary": "Statement of Requirements for business process analysis and improvement planning for the Division of Licensure and Regulatory Services (DLRS) at the Virginia Department of Criminal Justice Services (DCJS), in preparation for credential management system replacement. Scope includes process mapping, gap analysis, future-state recommendations, and roadmap development.",
    "sorType": "Business Process Reengineering",
    "services": [
      "Process Improvement",
      "Roadmap Development"
    ],
    "industries": [
      "Government",
      "Public Safety"
    ],
    "primaryTechnology": [
      "MS Office",
      "MS Teams"
    ],
    "techFocus": [
      "Process Analysis",
      "Gap Identification"
    ],
    "sector": "Public",
    "jurisdiction": {
      "level": "State",
      "state": "Virginia"
    },
    "agency": "DCJS, DLRS",
    "clientType": "State Agency",
    "client": "Virginia Department of Criminal Justice Services (DCJS) — Division of Licensure and Regulatory Services (DLRS)",
    "date": "2022-09-13",
    "pricingModel": "Fixed Price",
    "deliveryModel": "Hybrid",
    "securityCompliance": [],
    "constraints": [
      "Stakeholder Interviews",
      "Future-State Mapping",
      "Change Management",
      "COVID Guidelines",
      "Remote"
    ],
    "fundingType": "N/A",
    "complexity": "Medium",
    "tags": [],
    "documentPath": "existingSORDocs/SORdocs/SOR EXAMPLE_BPR_17578_DCJS SOR Credential Mgmt Business Process Analysis FINAL.docx",
    "version": "1.0",
    "lastReviewed": "2025-08-26"
  },
  {
    "id": "vdh-office-of-drinking-water-virginia-department-of-health-vdh-o",
    "name": "SOR EXAMPLE_BPR_17387_DWSRF Program New System Implementation Support SOR.docx",
    "summary": "Statement of Requirements for business process analysis, standardization, and project management governance framework to support new technology implementation for the Virginia Drinking Water State Revolving Fund (DWSRF) Program at VDH. Includes process mapping, future state recommendations, and training documentation.",
    "sorType": "Business Process Reengineering",
    "services": [
      "Process Improvement",
      "Project Management"
    ],
    "industries": [
      "Government",
      "Health"
    ],
    "primaryTechnology": [
      "MS Office",
      "PowerPoint"
    ],
    "techFocus": [
      "Process Analysis",
      "Governance"
    ],
    "sector": "Public",
    "jurisdiction": {
      "level": "State",
      "state": "Virginia"
    },
    "agency": "VDH, Office of Drinking Water",
    "clientType": "State Agency",
    "client": "Virginia Department of Health (VDH) — Office of Drinking Water",
    "date": "2022-03-01",
    "pricingModel": "Fixed Price",
    "deliveryModel": "Hybrid",
    "securityCompliance": [],
    "constraints": [
      "Multi-phase",
      "Standardization",
      "Training",
      "Coaching",
      "Stakeholder Interviews",
      "Remote"
    ],
    "fundingType": "N/A",
    "complexity": "Medium",
    "tags": [],
    "documentPath": "existingSORDocs/SORdocs/SOR EXAMPLE_BPR_17387_DWSRF Program New System Implementation Support SOR.docx",
    "version": "1.0",
    "lastReviewed": "2025-08-26"
  },
  {
    "id": "virginia-dss-it-services-virginia-department-of-social-services",